[
  {
    "id": "03964270-ba32-44a9-b0ed-c6ee84bc7676",
    "schemaVersion": "0.1.0",
    "name": "Schneidebrett mit Messerblock",
    "roomTypes": ["kueche"],
    "klasse": "D",
    "funktionsTyp": "schneidebrett",
    "anchorTypes": ["unterschrank"],
    "platzierung": "auf_oberflaeche",
    "masse": { "w": 0.34, "d": 0.24, "h": 0.22 },
    "achsenTags": { "temperatur": 0.5, "materialitaet": 0.6, "epoche": -0.1 },
    "attributTags": ["material:holz"],
    "assetStatus": "placeholder"
  },
  {
    "id": "4862a9b7-12b2-4b0e-99b0-88982e0f60eb",
    "schemaVersion": "0.1.0",
    "name": "Kaffeemaschine kompakt",
    "roomTypes": ["kueche"],
    "klasse": "D",
    "funktionsTyp": "kaffeemaschine",
    "anchorTypes": ["unterschrank"],
    "platzierung": "auf_oberflaeche",
    "masse": { "w": 0.2, "d": 0.28, "h": 0.34 },
    "achsenTags": { "temperatur": -0.1, "materialitaet": 0.3, "kontur": -0.2, "epoche": 0.4 },
    "attributTags": ["material:edelstahl", "farbe:schwarz"],
    "assetStatus": "placeholder"
  },
  {
    "id": "f22c15f3-67f3-4d20-b5ed-b4b459abe553",
    "schemaVersion": "0.1.0",
    "name": "Obstschale mit Früchten",
    "roomTypes": ["kueche"],
    "klasse": "D",
    "funktionsTyp": "obstschale",
    "anchorTypes": ["unterschrank", "esstisch", "tisch"],
    "platzierung": "auf_oberflaeche",
    "masse": { "w": 0.28, "d": 0.28, "h": 0.15 },
    "achsenTags": { "temperatur": 0.4, "farbigkeit": 0.6, "materialitaet": 0.4 },
    "attributTags": ["material:keramik"],
    "assetStatus": "placeholder"
  },
  {
    "id": "ab788c20-4308-40a8-8bf2-b986bea72113",
    "schemaVersion": "0.1.0",
    "name": "Gewürzgläser-Set auf Ablage",
    "roomTypes": ["kueche"],
    "klasse": "D",
    "funktionsTyp": "gewuerzglaeser",
    "anchorTypes": ["unterschrank", "kochfeld"],
    "platzierung": "auf_oberflaeche",
    "masse": { "w": 0.28, "d": 0.09, "h": 0.13 },
    "achsenTags": { "temperatur": 0.2, "materialitaet": 0.4, "farbigkeit": 0.5 },
    "attributTags": ["material:glas"],
    "assetStatus": "placeholder"
  },
  {
    "id": "84bdd8cd-e1f0-475f-8df7-3ff92ed07ab1",
    "schemaVersion": "0.1.0",
    "name": "Kräutertopf",
    "roomTypes": ["kueche"],
    "klasse": "D",
    "funktionsTyp": "kraeutertopf",
    "anchorTypes": ["unterschrank"],
    "platzierung": "auf_oberflaeche",
    "masse": { "w": 0.14, "d": 0.14, "h": 0.24 },
    "achsenTags": { "temperatur": 0.5, "farbigkeit": 0.5, "materialitaet": 0.5 },
    "attributTags": ["material:keramik", "pflanze:kraut"],
    "assetStatus": "placeholder"
  },
  {
    "id": "d78b7661-90c4-4844-b2d5-098b4f244cb0",
    "schemaVersion": "0.1.0",
    "name": "Gefaltetes Geschirrtuch",
    "roomTypes": ["kueche"],
    "klasse": "C",
    "funktionsTyp": "geschirrtuch",
    "anchorTypes": ["unterschrank"],
    "platzierung": "auf_oberflaeche",
    "masse": { "w": 0.3, "d": 0.22, "h": 0.06 },
    "achsenTags": { "temperatur": 0.6, "materialitaet": 0.7, "farbigkeit": 0.3 },
    "attributTags": ["material:textil", "farbe:beige"],
    "assetStatus": "placeholder"
  },
  {
    "id": "67902b9a-f5ad-4ebf-a529-222c4dfd4a9a",
    "schemaVersion": "0.1.0",
    "name": "Pendelleuchte über Kochinsel",
    "roomTypes": ["kueche"],
    "klasse": "C",
    "funktionsTyp": "pendelleuchte",
    "anchorTypes": ["esstisch", "unterschrank"],
    "platzierung": "an_decke",
    "masse": { "w": 0.35, "d": 0.35, "h": 0.5 },
    "achsenTags": { "temperatur": 0.5, "materialitaet": 0.5, "kontur": -0.2 },
    "attributTags": ["material:metall", "farbe:schwarz"],
    "assetStatus": "placeholder"
  }
]
