[
  {
    "id": "38e0eb00-e3d3-4791-a12a-06f294a9960c",
    "schemaVersion": "0.1.0",
    "name": "Bücherstapel",
    "roomTypes": ["wohnen"],
    "klasse": "D",
    "funktionsTyp": "buecherstapel",
    "anchorTypes": ["couchtisch", "sideboard", "regal"],
    "platzierung": "auf_oberflaeche",
    "masse": { "w": 0.24, "d": 0.18, "h": 0.16 },
    "achsenTags": { "materialitaet": 0.4, "farbigkeit": 0.4, "epoche": 0.2 },
    "attributTags": ["material:papier", "farbe:gemischt"],
    "assetStatus": "placeholder"
  },
  {
    "id": "81a7488d-dbe1-4fe1-9873-aedb4fcdf58e",
    "schemaVersion": "0.1.0",
    "name": "Vase schlank",
    "roomTypes": ["wohnen"],
    "klasse": "D",
    "funktionsTyp": "vase",
    "anchorTypes": ["couchtisch", "sideboard"],
    "platzierung": "auf_oberflaeche",
    "masse": { "w": 0.14, "d": 0.14, "h": 0.32 },
    "achsenTags": { "temperatur": 0.3, "kontur": 0.2, "materialitaet": 0.4 },
    "attributTags": ["material:keramik"],
    "assetStatus": "placeholder"
  },
  {
    "id": "47ed353f-18c7-4e50-b732-eefbda54705b",
    "schemaVersion": "0.1.0",
    "name": "Kerzenständer-Paar",
    "roomTypes": ["wohnen"],
    "klasse": "D",
    "funktionsTyp": "kerzenstaender",
    "anchorTypes": ["couchtisch", "sideboard"],
    "platzierung": "auf_oberflaeche",
    "masse": { "w": 0.2, "d": 0.1, "h": 0.24 },
    "achsenTags": { "temperatur": 0.7, "opulenz": 0.3, "materialitaet": 0.5 },
    "attributTags": ["material:metall"],
    "assetStatus": "placeholder"
  },
  {
    "id": "16575ce5-05fe-435f-9853-2a4c3791c11b",
    "schemaVersion": "0.1.0",
    "name": "Deko-Schale mit Kugeln",
    "roomTypes": ["wohnen"],
    "klasse": "D",
    "funktionsTyp": "dekoschale",
    "anchorTypes": ["couchtisch"],
    "platzierung": "auf_oberflaeche",
    "masse": { "w": 0.3, "d": 0.2, "h": 0.09 },
    "achsenTags": { "materialitaet": 0.5, "temperatur": 0.3, "kontur": 0.3 },
    "attributTags": ["material:keramik"],
    "assetStatus": "placeholder"
  },
  {
    "id": "6da6adad-8474-4ec9-a987-8e02e5b10a1c",
    "schemaVersion": "0.1.0",
    "name": "Gefaltetes Plaid",
    "roomTypes": ["wohnen"],
    "klasse": "C",
    "funktionsTyp": "plaid",
    "anchorTypes": ["sofa"],
    "platzierung": "auf_oberflaeche",
    "masse": { "w": 0.55, "d": 0.42, "h": 0.12 },
    "achsenTags": { "temperatur": 0.8, "materialitaet": 0.7, "farbigkeit": 0.3 },
    "attributTags": ["material:textil", "farbe:beige"],
    "assetStatus": "placeholder"
  },
  {
    "id": "c25617eb-1896-4b78-84ff-db1dfdc21db1",
    "schemaVersion": "0.1.0",
    "name": "Zimmerpflanze mittel",
    "roomTypes": ["wohnen"],
    "klasse": "B",
    "funktionsTyp": "zimmerpflanze",
    "anchorTypes": ["ecke"],
    "platzierung": "freie_ecke",
    "masse": { "w": 0.34, "d": 0.34, "h": 1.05 },
    "achsenTags": { "temperatur": 0.5, "materialitaet": 0.6, "farbigkeit": 0.5 },
    "attributTags": ["material:keramik", "pflanze:gruenpflanze"],
    "assetStatus": "placeholder"
  }
]
